{
  "schemaVersion": 1,
  "id": "the-midnight-data-center",
  "slug": "the-midnight-data-center",
  "title": "The Midnight Data Center",
  "synopsis": "A junior engineer traces mysterious server alerts to a small, overlooked environmental problem.",
  "revision": "2026-10-23-3",
  "genreIds": [
    "ai"
  ],
  "levels": [
    "general"
  ],
  "chapters": [
    {
      "id": "chapter-1",
      "number": 1,
      "title": "The Red Dashboard",
      "paragraphs": [
        "At 12:17 a.m., the rack temperature shot upward. Nikhil had one hour before customers might be affected—and the dashboard insisted nothing was wrong.",
        "At 12:17 a.m., Nikhil received an alert from a data center outside Bengaluru. One server rack was reporting rising temperatures, but the cooling dashboard insisted that everything was normal. The senior engineer told him to verify the physical sensors before changing any settings.",
        "Nikhil checked the logs and noticed that the temperature spikes occurred whenever a particular backup job started. He suspected a software fault, but the rack's independent thermometer showed that the heat was real."
      ]
    },
    {
      "id": "chapter-2",
      "number": 2,
      "title": "A Pattern in the Logs",
      "paragraphs": [
        "He compared power use, fan speed and airflow across neighboring racks. Only the rack near the storage door was affected. The backup job increased its load, but not enough to explain the sudden jump.",
        "His colleague Farah asked whether someone had moved equipment that afternoon. A maintenance record showed a delivery of spare cables. The timing matched the first alert."
      ]
    },
    {
      "id": "chapter-3",
      "number": 3,
      "title": "The Cable Cart",
      "paragraphs": [
        "With the on-site technician, they inspected the aisle. A cart of cable boxes had been left against an air-return grille. The cooling system worked correctly, but the warm air could not escape efficiently.",
        "Nikhil felt embarrassed that he had nearly restarted a healthy server. Farah reminded him that dashboards show measurements, not the entire room. They moved the cart after following the site's safety procedure and watched the temperature begin to fall."
      ]
    },
    {
      "id": "chapter-4",
      "number": 4,
      "title": "The False Fix",
      "paragraphs": [
        "The alarms stopped, but Nikhil did not close the incident immediately. He checked the backup job again and saw a smaller temperature rise. The blocked grille had been the main cause, yet the workload still needed better scheduling.",
        "They moved the nonurgent backup to a quieter window and added a check for airflow obstructions to the maintenance checklist. Both changes were documented so the next shift could understand what had happened."
      ]
    },
    {
      "id": "chapter-5",
      "number": 5,
      "title": "The Postmortem",
      "paragraphs": [
        "At the morning review, a manager asked why the automated monitoring system had not identified the cable cart. Nikhil explained that the system could detect heat but had no camera or inventory data showing objects near the grille.",
        "Instead of proposing more surveillance, the team improved its physical inspection routine and made the alarm instructions clearer. The solution was less glamorous than an AI prediction engine, but it addressed the actual failure."
      ]
    },
    {
      "id": "chapter-6",
      "number": 6,
      "title": "A Quiet Shift",
      "paragraphs": [
        "A week later, the backup ran without alarms. Nikhil still watched the graph, but he no longer treated the dashboard as a complete picture of reality.",
        "Farah sent him a message: 'How is your mysterious server?' He replied with a photograph of an empty air-return grille. 'The server was innocent,' he wrote. 'The cardboard boxes were not.'",
        "Nikhil checked the backup graph and then the empty air-return grille. Both were clear. Only then did he close the incident."
      ]
    }
  ]
}
